Symbol,Name,Last Sale,Net Change,% Change,Market Cap,Country,IPO Year,Volume,Sector,Industry
DAVE,Dave Inc. Class A Common Stock,$44.54,1.43,3.317%,551688831.0,United States,,144406,Finance,Finance: Consumer Services
DAWN,Day One Biopharmaceuticals Inc. Common Stock,$13.76,0.15,1.102%,1202484460.0,United States,2021.0,522069,Health Care,Biotechnology: Pharmaceutical Preparations
DAY,Dayforce Inc. Common Stock,$53.14,-1.04,-1.92%,8390806000.0,United States,2018.0,1533910,Technology,EDP Services
DB,Deutsche Bank AG Common Stock,$16.56,-0.44,-2.588%,33782400000.0,Germany,,914177,Finance,Major Banks
DBD,Diebold Nixdorf Incorporated Common stock,$42.90,-0.6,-1.379%,1611610057.0,United States,2023.0,149536,Miscellaneous,Office Equipment/Supplies/Services
DBI,Designer Brands Inc. Class A Common Stock,$9.33,-0.21,-2.201%,534053520.0,United States,,1135823,Consumer Discretionary,Clothing/Shoe/Accessory Stores
DBRG,DigitalBridge Group Inc.,$13.39,0.2,1.516%,2326930536.0,United States,2014.0,1760443,Real Estate,Real Estate Investment Trusts
DBX,Dropbox Inc. Class A Common Stock,$23.17,0.34,1.489%,7650553436.0,United States,2018.0,5086384,Technology,Computer Software: Prepackaged Software
DCBO,Docebo Inc. Common Shares,$36.23,-0.46,-1.254%,1149119156.0,Canada,,119422,Technology,Computer Software: Prepackaged Software
DCGO,DocGo Inc. Common Stock,$3.04,-0.12,-3.797%,308759245.0,United States,2020.0,612528,Health Care,Medical/Nursing Services
DCI,Donaldson Company Inc. Common Stock,$72.40,-0.45,-0.618%,8714724795.0,United States,,666387,Industrials,Pollution Control Equipment
DCO,Ducommun Incorporated Common Stock,$57.64,0.0,0.00%,848249722.0,United States,,58479,Industrials,Military/Government/Technical
DCOM,Dime Community Bancshares Inc. Common Stock,$18.17,-0.45,-2.417%,708085827.0,United States,,155209,Finance,Major Banks
DCOMP,Dime Community Bancshares Inc. Fixed-Rate Non-Cumulative Perpetual Preferred Stock Series A,$17.8599,-0.04,-0.223%,696001214.0,United States,,8171,Finance,Major Banks
DCPH,Deciphera Pharmaceuticals Inc. Common Stock,$25.51,0.0,0.00%,2206002046.0,United States,2017.0,1062075,Health Care,Biotechnology: Pharmaceutical Preparations
DD,DuPont de Nemours Inc. Common Stock,$81.27,-0.82,-0.999%,33979343775.0,United States,2017.0,2908954,Industrials,Major Chemicals
DDD,3D Systems Corporation Common Stock,$3.51,-0.17,-4.62%,468353512.0,United States,,1293064,Technology,Computer Software: Prepackaged Software
DDI,DoubleDown Interactive Co. Ltd. American Depository Shares,$11.47,-0.94,-7.575%,568377957.0,South Korea,2021.0,4601,Technology,EDP Services
DDOG,Datadog Inc. Class A Common Stock,$121.68,-0.43,-0.352%,40701815444.0,United States,2019.0,1775783,Technology,EDP Services
DDS,Dillard's Inc. Common Stock,$445.54,-5.83,-1.292%,7231148952.0,United States,,49167,Consumer Discretionary,Department/Specialty Retail Stores
DDT,Dillard's Capital Trust I,$25.79,0.06,0.233%,418573712.0,United States,,3682,Consumer Discretionary,Department/Specialty Retail Stores
DE,Deere & Company Common Stock,$364.98,-4.29,-1.162%,101595179486.0,United States,,1672427,Industrials,Industrial Machinery/Components
DEA,Easterly Government Properties Inc. Common Stock,$11.38,-0.18,-1.557%,1172128381.0,United States,2015.0,963817,Real Estate,Real Estate Investment Trusts
DEC,Diversified Energy Company plc Ordinary Shares,$14.21,-0.47,-3.202%,675414501.0,,,291153,,
DECK,Deckers Outdoor Corporation Common Stock,$1064.92,-14.22,-1.318%,27094221775.0,United States,1993.0,362642,Consumer Discretionary,Shoe Manufacturing
DEI,Douglas Emmett Inc. Common Stock,$12.98,-0.24,-1.815%,2172576006.0,United States,2006.0,1504490,Real Estate,Real Estate Investment Trusts
DELL,Dell Technologies Inc. Class C Common Stock ,$179.21,13.13,7.906%,127918365935.0,United States,2018.0,23096094,Technology,Computer Manufacturing
DENN,Denny's Corporation Common Stock,$6.82,-0.18,-2.571%,354766736.0,United States,,480621,Consumer Discretionary,Restaurants
DEO,Diageo plc Common Stock,$131.44,-2.59,-1.932%,73406108836.0,United Kingdom,,525700,Consumer Staples,Beverages (Production/Distribution)
DESP,Despegar.com Corp. Ordinary Shares,$15.25,0.1,0.66%,1098826687.0,Argentina,2017.0,927536,Consumer Discretionary,Transportation Services
DFH,Dream Finders Homes Inc. Class A Common Stock,$27.55,-1.1,-3.839%,2582212737.0,United States,2022.0,490188,Consumer Discretionary,Homebuilding
DFIN,Donnelley Financial Solutions Inc. Common Stock ,$60.40,-0.43,-0.707%,1770678790.0,United States,2016.0,127104,Consumer Discretionary,Other Consumer Services
DFS,Discover Financial Services Common Stock,$121.68,-0.14,-0.115%,30492890822.0,United States,,1159391,Finance,Finance: Consumer Services
DG,Dollar General Corporation Common Stock,$139.28,-2.99,-2.102%,30595820892.0,United States,2009.0,3794997,Consumer Discretionary,Department/Specialty Retail Stores
DGICA,Donegal Group Inc. Class A Common Stock,$12.87,-0.19,-1.455%,429773431.0,United States,,46631,Finance,Property-Casualty Insurers
DGICB,Donegal Group Inc. Class B Common Stock,$12.03,0.0,0.00%,401722951.0,United States,1986.0,19,Finance,Property-Casualty Insurers
DGII,Digi International Inc. Common Stock,$24.86,-0.48,-1.894%,904272432.0,United States,1989.0,156408,Telecommunications,Computer Communications Equipment
DGX,Quest Diagnostics Incorporated Common Stock,$138.19,-0.72,-0.518%,15351744611.0,United States,,986768,Health Care,Medical Specialities
DH,Definitive Healthcare Corp. Class A Common Stock,$5.30,-0.17,-3.108%,625053979.0,United States,2021.0,1117925,Technology,Computer Software: Prepackaged Software
DHC,Diversified Healthcare Trust Common Shares of Beneficial Interest,$2.29,-0.12,-4.979%,550501623.0,United States,,809271,Real Estate,Real Estate Investment Trusts
DHCNI,Diversified Healthcare Trust 5.625% Senior Notes due 2042,$13.10,0.03,0.23%,3149157758.0,United States,,13219,Real Estate,Real Estate Investment Trusts
DHCNL,Diversified Healthcare Trust 6.25% Senior Notes Due 2046,$14.12,0.09,0.641%,3394359355.0,United States,,10251,Real Estate,Real Estate Investment Trusts
DHI,D.R. Horton Inc. Common Stock,$141.38,-1.47,-1.029%,46558165622.0,United States,,1850275,Consumer Discretionary,Homebuilding
DHIL,Diamond Hill Investment Group Inc. Class A Common Stock,$148.70,-0.88,-0.588%,412328743.0,United States,,15691,Finance,Investment Managers
DHR,Danaher Corporation Common Stock,$255.93,-2.78,-1.075%,189563906438.0,United States,,2930989,Industrials,Industrial Machinery/Components
DHT,DHT Holdings Inc.,$12.01,-0.18,-1.477%,1933604499.0,Jersey,2005.0,1611741,Consumer Discretionary,Marine Transportation
DIN,Dine Brands Global Inc. Common Stock,$37.64,-0.66,-1.723%,579827977.0,United States,,391071,Consumer Discretionary,Restaurants
DINO,HF Sinclair Corporation Common Stock,$53.63,-2.27,-4.061%,10305403507.0,United States,1960.0,1345474,Energy,Oil & Gas Production
DIOD,Diodes Incorporated Common Stock,$71.75,-2.07,-2.804%,3309318362.0,United States,,206154,Technology,Semiconductors
DIS,Walt Disney Company (The) Common Stock,$100.88,-1.56,-1.523%,183908580463.0,United States,,7361196,Consumer Discretionary,Services-Misc. Amusement & Recreation
DJCO,Daily Journal Corp. (S.C.) Common Stock,$373.90,-7.2,-1.889%,514870021.0,United States,,8935,Consumer Discretionary,Newspapers/Magazines
DJT,Trump Media & Technology Group Corp. Common Stock,$51.12,1.19,2.383%,9032933803.0,United States,2024.0,3159728,Technology,Computer Software: Programming Data Processing
DJTWW,Trump Media & Technology Group Corp. Warrants,$29.38,0.79,2.763%,5191463129.0,United States,2021.0,296681,Technology,Computer Software: Programming Data Processing
DK,Delek US Holdings Inc. Common Stock,$25.92,-1.24,-4.566%,1662277438.0,United States,2017.0,691932,Energy,Integrated oil Companies
DKL,Delek Logistics Partners L.P. Common Units representing Limited Partner Interests,$39.32,-0.43,-1.082%,1856535086.0,United States,2012.0,48889,Energy,Natural Gas Distribution
DKNG,DraftKings Inc. Class A Common Stock,$35.96,-0.65,-1.775%,17125004000.0,United States,2019.0,13187235,Consumer Discretionary,Services-Misc. Amusement & Recreation
DKS,Dick's Sporting Goods Inc Common Stock,$226.03,31.03,15.913%,18635797160.0,United States,2002.0,5100177,Consumer Discretionary,Other Specialty Stores
DLB,Dolby Laboratories Common Stock,$78.23,-1.06,-1.337%,7497206002.0,United States,2005.0,195113,Technology,EDP Services
DLO,DLocal Limited Class A Common Shares,$9.22,-0.21,-2.227%,2729043151.0,Uruguay,2021.0,2616456,Consumer Discretionary,Business Services
DLR,Digital Realty Trust Inc. Common Stock,$141.43,-2.34,-1.628%,44186496018.0,United States,2004.0,1340081,Real Estate,Real Estate Investment Trusts
DLTR,Dollar Tree Inc. Common Stock,$113.83,0.81,0.717%,24813006939.0,United States,1995.0,2230221,Consumer Discretionary,Department/Specialty Retail Stores
DLX,Deluxe Corporation Common Stock,$22.02,-0.11,-0.497%,969889309.0,United States,,232999,Consumer Discretionary,Advertising
DLY,DoubleLine Yield Opportunities Fund Common Shares of Beneficial Interest,$15.33,-0.17,-1.097%,735008792.0,United States,2020.0,185791,Finance,Investment Managers
DMF,BNY Mellon Municipal Income Inc. Common Stock,$6.76,-0.08,-1.17%,421086173.0,United States,1988.0,34223,Finance,Finance/Investors Services
DMLP,Dorchester Minerals L.P. Common Units Representing Limited Partnership Interests,$32.25,-0.24,-0.739%,1292857737.0,United States,,25733,Energy,Oil & Gas Production
DMRC,Digimarc Corporation Common Stock,$26.695,-0.435,-1.603%,570560857.0,United States,,139575,Technology,EDP Services
DNA,Ginkgo Bioworks Holdings Inc. Class A Common Stock,$0.5607,-0.0642,-10.274%,1239863557.0,United States,2021.0,57853547,Health Care,Biotechnology: Biological Products (No Diagnostic Substances)
DNB,Dun & Bradstreet Holdings Inc. Common Stock,$9.37,-0.19,-1.987%,4148263087.0,United States,2020.0,3679281,Finance,Finance: Consumer Services
DNLI,Denali Therapeutics Inc. Common Stock,$18.04,-0.86,-4.55%,2572667009.0,United States,2017.0,820658,Health Care,Biotechnology: Biological Products (No Diagnostic Substances)
DNN,Denison Mines Corp Ordinary Shares (Canada),$2.42,0.02,0.833%,2156211218.0,Canada,,19126033,,
DNOW,DNOW Inc. Common Stock,$14.06,-0.31,-2.157%,1501643839.0,United States,2014.0,596167,Industrials,Metal Fabrications
DNTH,Dianthus Therapeutics Inc. Common Stock,$22.16,0.24,1.095%,650384233.0,United States,2018.0,58780,Health Care,Biotechnology: Pharmaceutical Preparations
DNUT,Krispy Kreme Inc. Common Stock,$10.12,-0.64,-5.948%,1707244000.0,United States,2021.0,3435837,Consumer Staples,Food Chains
DO,Diamond Offshore Drilling Inc. Common Stock,$14.63,-0.51,-3.369%,1499300541.0,United States,2022.0,1364674,Energy,Oil & Gas Production
DOC,Healthpeak Properties Inc. Common Stock,$18.96,0.05,0.264%,13343697543.0,United States,,4265167,Real Estate,Real Estate Investment Trusts
DOCN,DigitalOcean Holdings Inc. Common Stock,$36.50,-0.83,-2.223%,3324833326.0,United States,2021.0,1487262,Technology,Computer Software: Programming Data Processing
DOCS,Doximity Inc. Class A Common Stock,$28.52,-0.18,-0.627%,5288345328.0,United States,2021.0,994228,Technology,EDP Services
DOCU,DocuSign Inc. Common Stock,$58.50,0.79,1.369%,12016785047.0,United States,1989.0,1236120,Technology,Computer Software: Prepackaged Software
DOLE,Dole plc Ordinary Shares,$12.22,-0.13,-1.053%,1160034567.0,Ireland,2021.0,517894,Consumer Staples,Farming/Seeds/Milling
DOOO,BRP Inc. (Recreational Products) Common Subordinate Voting Shares,$65.20,-1.92,-2.861%,4887161779.0,Canada,,97202,Consumer Discretionary,Industrial Specialties
DORM,Dorman Products Inc. Common Stock,$90.96,-0.66,-0.72%,2820939933.0,United States,,97365,Consumer Discretionary,Auto Parts:O.E.M.
DOV,Dover Corporation Common Stock,$181.54,-1.94,-1.057%,24949071246.0,United States,,968818,Industrials,Industrial Machinery/Components
DOW,Dow Inc. Common Stock ,$57.00,-1.04,-1.792%,40082732310.0,United States,2019.0,2968026,Industrials,Major Chemicals
DOX,Amdocs Limited Ordinary Shares,$78.01,-0.78,-0.99%,9154303360.0,Guernsey,,1226833,Technology,EDP Services
DOYU,DouYu International Holdings Limited ADS,$10.21,-0.09,-0.874%,322999211.0,China,2019.0,45478,Technology,Computer Software: Programming Data Processing
DPZ,Domino's Pizza Inc Common Stock,$510.01,0.93,0.183%,17789259472.0,United States,2004.0,478569,Consumer Discretionary,Food Distributors
DQ,DAQO New Energy Corp. American Depositary Shares each representing five ordinary shares,$21.28,1.35,6.774%,1404638557.0,China,2010.0,1470926,Technology,Semiconductors
DRD,DRDGOLD Limited American Depositary Shares,$8.36,-0.34,-3.908%,722796162.0,South Africa,,204678,Basic Materials,Precious Metals
DRH,Diamondrock Hospitality Company Common Stock,$8.39,-0.06,-0.71%,1762440593.0,United States,2005.0,2775286,Real Estate,Real Estate Investment Trusts
DRI,Darden Restaurants Inc. Common Stock,$145.98,-2.34,-1.578%,17424019083.0,United States,,964068,Consumer Discretionary,Restaurants
DRQ,Dril-Quip Inc. Common Stock,$18.34,-0.35,-1.873%,631270484.0,United States,1997.0,199266,Industrials,Metal Fabrications
DRS,Leonardo DRS Inc. Common Stock,$23.23,-0.55,-2.313%,6112791029.0,Israel,,353488,Industrials,Industrial Machinery/Components
DRVN,Driven Brands Holdings Inc. Common Stock,$11.69,0.17,1.476%,1918092687.0,United States,2021.0,1258906,Consumer Discretionary,Automotive Aftermarket
DSGR,Distribution Solutions Group Inc. Common Stock,$34.42,-1.15,-3.233%,1611158930.0,United States,,51985,Consumer Discretionary,Industrial Specialties
DSGX,Descartes Systems Group Inc. (The) Common Stock,$97.60,-1.54,-1.553%,8313905208.0,Canada,,335614,,
DSL,DoubleLine Income Solutions Fund Common Shares of Beneficial Interests,$12.36,-0.04,-0.323%,1260680794.0,United States,2013.0,315904,Finance,Trusts Except Educational Religious and Charitable
DSP,Viant Technology Inc. Class A Common Stock,$9.71,-0.06,-0.614%,616532479.0,United States,2021.0,89137,Technology,Computer Software: Programming Data Processing
DSX,Diana Shipping inc. common stock,$3.01,-0.03,-0.987%,361088380.0,Greece,2005.0,1212407,Consumer Discretionary,Marine Transportation
DT,Dynatrace Inc. Common Stock,$46.22,0.17,0.369%,13742996193.0,United States,2019.0,2856097,Technology,Computer Software: Prepackaged Software
DTB,DTE Energy Company 2020 Series G 4.375% Junior Subordinated Debentures due 2080,$18.85,-0.13,-0.685%,3900767049.0,United States,2020.0,9962,Utilities,Electric Utilities: Central
DTE,DTE Energy Company Common Stock,$110.97,-2.03,-1.796%,22963825967.0,United States,,788790,Utilities,Electric Utilities: Central
DTG,DTE Energy Company 2021 Series E 4.375% Junior Subordinated Debentures,$19.06,-0.17,-0.884%,3944223871.0,United States,2021.0,25052,Utilities,Electric Utilities: Central
DTM,DT Midstream Inc. Common Stock ,$65.61,-0.83,-1.249%,6371328051.0,United States,2021.0,361081,Utilities,Natural Gas Distribution
DTW,DTE Energy Company 2017 Series E 5.25% Junior Subordinated Debentures due 2077,$22.53,-0.11,-0.486%,4662296107.0,United States,2017.0,17079,Utilities,Electric Utilities: Central
DUK,Duke Energy Corporation (Holding Company) Common Stock,$100.42,-0.76,-0.751%,77501004017.0,United States,,2527914,Utilities,Power Generation
DUKB,Duke Energy Corporation 5.625% Junior Subordinated Debentures due 2078,$23.992,-0.108,-0.448%,18516272539.0,United States,2018.0,23075,Utilities,Power Generation
DUOL,Duolingo Inc. Class A Common Stock,$196.10,1.94,0.999%,8456247340.0,United States,2021.0,747748,Technology,Computer Software: Prepackaged Software
DV,DoubleVerify Holdings Inc. Common Stock,$19.04,-0.01,-0.052%,3271004237.0,United States,2021.0,2508787,Technology,Computer Software: Programming Data Processing
DVA,DaVita Inc. Common Stock,$146.69,3.02,2.102%,12864713000.0,United States,,1216388,Health Care,Misc Health and Biotechnology Services
DVAX,Dynavax Technologies Corporation Common Stock,$11.53,0.03,0.261%,1509181416.0,United States,2004.0,2778690,Health Care,Biotechnology: Pharmaceutical Preparations
DVN,Devon Energy Corporation Common Stock,$47.19,-1.72,-3.517%,29824080000.0,United States,1985.0,10301579,Energy,Oil & Gas Production
DX,Dynex Capital Inc. Common Stock,$12.01,-0.13,-1.071%,770572781.0,United States,,635685,Real Estate,Real Estate Investment Trusts
DXC,DXC Technology Company Common Stock ,$15.09,-0.07,-0.462%,2759518048.0,United States,,4366947,Technology,EDP Services
DXCM,DexCom Inc. Common Stock,$127.64,0.26,0.204%,50760364955.0,United States,2005.0,1349723,Health Care,Medical/Dental Instruments
DXPE,DXP Enterprises Inc. Common Stock,$49.08,-0.56,-1.128%,781761209.0,United States,,115691,Industrials,Industrial Machinery/Components
DY,Dycom Industries Inc. Common Stock,$180.48,2.55,1.433%,5250737848.0,United States,,361049,Industrials,Water Sewer Pipeline Comm & Power Line Construction
DYN,Dyne Therapeutics Inc. Common Stock,$31.08,1.07,3.565%,2715852389.0,United States,2020.0,1359148,Health Care,Biotechnology: Pharmaceutical Preparations
E,ENI S.p.A. Common Stock,$31.12,-0.52,-1.643%,52529593631.0,Italy,,482176,Energy,Oil & Gas Production
EA,Electronic Arts Inc. Common Stock,$131.97,0.11,0.083%,35153999546.0,United States,,2427418,Technology,Computer Software: Prepackaged Software
EAF,GrafTech International Ltd. Common Stock,$1.77,-0.02,-1.117%,455185815.0,United States,2018.0,2532307,Energy,Industrial Machinery/Components
EAI,Entergy Arkansas LLC First Mortgage Bonds 4.875% Series Due September 1 2066,$21.20,-0.11,-0.516%,4526983043.0,United States,2016.0,22978,Utilities,Electric Utilities: Central
EAT,Brinker International Inc. Common Stock,$68.55,0.67,0.987%,3049824872.0,United States,,1228338,Consumer Discretionary,Restaurants
EB,Eventbrite Inc. Class A Common Stock,$4.91,-0.11,-2.191%,476835995.0,United States,2018.0,1999705,Technology,Computer Software: Programming Data Processing
EBAY,eBay Inc. Common Stock,$52.09,-0.81,-1.531%,26357540000.0,United States,1998.0,6445463,Consumer Discretionary,Business Services
EBC,Eastern Bankshares Inc. Common Stock,$13.27,-0.14,-1.044%,2343899700.0,United States,2020.0,814928,Finance,Savings Institutions
EBF,Ennis Inc. Common Stock,$20.57,-0.14,-0.676%,534491168.0,United States,,98893,Consumer Discretionary,Office Equipment/Supplies/Services
EBR,Centrais Electricas Brasileiras S A American Depositary Shares (Each representing one Common Share),$6.80,-0.2,-2.857%,15271537118.0,Brazil,2016.0,652300,Utilities,Electric Utilities: Central
EBTC,Enterprise Bancorp Inc Common Stock,$24.46,-0.76,-3.013%,302684624.0,United States,,17103,Finance,Major Banks
EC,Ecopetrol S.A. American Depositary Shares,$12.30,-0.13,-1.046%,25286767241.0,Colombia,,2033313,Energy,Oil & Gas Production
ECAT,BlackRock ESG Capital Allocation Term Trust Common Shares of Beneficial Interest,$17.60,-0.25,-1.401%,1903176000.0,,2021.0,436315,Finance,Trusts Except Educational Religious and Charitable
ECC           ,Eagle Point Credit Company Inc. Common Stock,$10.15,-0.07,-0.685%,615724619.0,United States,2014.0,1120814,Finance,Trusts Except Educational Religious and Charitable
ECCC,Eagle Point Credit Company Inc. 6.50% Series C Term Preferred Stock due 2031,$22.23,-0.0099,-0.045%,1348527909.0,United States,,1690,Finance,Trusts Except Educational Religious and Charitable
ECCF,Eagle Point Credit Company Inc. 8.00% Series F Term Preferred Stock due 2029,$24.8319,0.0219,0.088%,27033814798.0,United States,,4599,,
ECCV,Eagle Point Credit Company Inc. 5.375% Notes due 2029,$22.5725,0.1125,0.501%,1369304823.0,United States,2022.0,2120,Finance,Trusts Except Educational Religious and Charitable
ECCW,Eagle Point Credit Company Inc. 6.75% Notes due 2031,$24.05,0.135,0.564%,1458933702.0,United States,2021.0,1000,Finance,Trusts Except Educational Religious and Charitable
ECCX,Eagle Point Credit Company Inc. 6.6875% Notes due 2028,$24.32,0.02,0.082%,1475312584.0,United States,2022.0,5184,Finance,Trusts Except Educational Religious and Charitable
ECL,Ecolab Inc. Common Stock,$226.13,-2.77,-1.21%,64575893221.0,United States,,851106,Consumer Discretionary,Package Goods/Cosmetics
ECPG,Encore Capital Group Inc Common Stock,$43.38,-0.94,-2.121%,1027536204.0,United States,,78750,Finance,Finance Companies
ECVT,Ecovyst Inc. Common Stock,$9.15,-0.14,-1.507%,1070600197.0,United States,2017.0,660187,Industrials,Major Chemicals
ECX,ECARX Holdings Inc. Class A Ordinary shares,$1.15,-0.01,-0.862%,388642460.0,China,,538395,Technology,EDP Services
ED,Consolidated Edison Inc. Common Stock,$91.91,-1.3,-1.395%,31785668288.0,United States,,2013463,Utilities,Power Generation
EDIT,Editas Medicine Inc. Common Stock,$5.10,-0.22,-4.135%,419413667.0,United States,2016.0,1874101,Health Care,Biotechnology: Biological Products (No Diagnostic Substances)
EDN,Empresa Distribuidora Y Comercializadora Norte S.A. (Edenor) American Depositary Shares,$18.20,0.91,5.263%,824874141.0,Argentina,2007.0,94296,Utilities,Electric Utilities: Central
EDR,Endeavor Group Holdings Inc. Class A Common Stock,$26.76,0.01,0.037%,18541157046.0,United States,2021.0,1537354,Consumer Discretionary,Services-Misc. Amusement & Recreation
EDU,New Oriental Education & Technology Group Inc. Sponsored ADR representing 10 Ordinary Share (Cayman Islands),$84.44,3.06,3.76%,13975869505.0,China,2006.0,1365783,Real Estate,Other Consumer Services
EE,Excelerate Energy Inc. Class A Common Stock,$16.85,-0.22,-1.289%,1805064776.0,United States,2022.0,248050,Utilities,Oil/Gas Transmission
EEFT,Euronet Worldwide Inc. Common Stock,$111.13,-1.42,-1.262%,5097659344.0,United States,1997.0,208166,Finance,Investment Bankers/Brokers/Service
EEX,Emerald Holding Inc. Common Stock,$5.62,-0.33,-5.546%,1145561922.0,United States,2017.0,31947,Consumer Discretionary,Business Services
EFC,Ellington Financial Inc. Common Stock ,$11.92,-0.1,-0.832%,1013699603.0,United States,2010.0,844763,Finance,Real Estate
EFSC,Enterprise Financial Services Corporation Common Stock,$37.56,-0.66,-1.727%,1408188740.0,United States,,108839,Finance,Major Banks
EFSCP,Enterprise Financial Services Corporation Depositary Shares Each Representing a 1/40th Interest in a Share of 5% Fixed Rate Non-Cumulative Perpetual Preferred Stock Series A,$19.60,-0.36,-1.804%,734837575.0,United States,,8334,Finance,Major Banks
EFT,Eaton Vance Floating Rate Income Trust Common Shares of Beneficial Interest,$13.21,-0.08,-0.602%,384284382.0,United States,2004.0,65394,Finance,Finance Companies
EFX,Equifax Inc. Common Stock,$230.86,-5.65,-2.389%,28536907027.0,United States,,861593,Finance,Finance: Consumer Services
EFXT,Enerflex Ltd Common Shares,$5.02,-0.1,-1.953%,622263462.0,Canada,2022.0,124490,Industrials,Industrial Machinery/Components
EG,Everest Group Ltd. Common Stock,$382.69,-5.77,-1.485%,16631035779.0,Bermuda,,228277,Finance,Property-Casualty Insurers
EGBN,Eagle Bancorp Inc. Common Stock,$17.10,-0.74,-4.148%,516242793.0,United States,,421094,Finance,Major Banks
EGHT,8x8 Inc Common Stock,$2.73,-0.24,-8.081%,342276947.0,United States,,1041307,Technology,EDP Services
EGO,Eldorado Gold Corporation Ordinary Shares,$16.07,0.19,1.196%,3264433301.0,Canada,,1674574,Basic Materials,Precious Metals
EGP,EastGroup Properties Inc. Common Stock,$158.87,-0.6,-0.376%,7648686847.0,United States,,180988,Real Estate,Real Estate Investment Trusts
EGY,VAALCO Energy Inc.  Common Stock,$6.25,0.01,0.16%,646597031.0,United States,,771616,,
EH,EHang Holdings Limited ADS,$16.54,0.7,4.419%,1050384956.0,China,2019.0,1032583,Industrials,Military/Government/Technical
EHAB,Enhabit Inc. Common Stock,$9.05,-0.04,-0.44%,453906524.0,United States,2022.0,291827,Health Care,Medical/Nursing Services
EHC,Encompass Health Corporation Common Stock,$84.23,0.76,0.911%,8480724251.0,United States,,590849,Health Care,Hospital/Nursing Management
EIG,Employers Holdings Inc Common Stock,$40.75,-0.14,-0.342%,1032747788.0,United States,2007.0,141541,Finance,Property-Casualty Insurers
EIX,Edison International Common Stock,$73.35,-0.79,-1.066%,28221636951.0,United States,,2244792,Utilities,Electric Utilities: Central
EL,Estee Lauder Companies Inc. (The) Common Stock,$121.55,-4.51,-3.578%,43583446907.0,United States,1995.0,3321242,Consumer Discretionary,Package Goods/Cosmetics
ELAN,Elanco Animal Health Incorporated Common Stock,$17.40,0.26,1.517%,8598760188.0,United States,2018.0,6041535,Health Care,Biotechnology: Pharmaceutical Preparations
ELC,Entergy Louisiana Inc. Collateral Trust Mortgage Bonds 4.875 % Series due September 1 2066,$21.18,-0.18,-0.843%,4516371351.0,United States,2016.0,12032,Utilities,Electric Utilities: Central
ELF,e.l.f. Beauty Inc. Common Stock,$183.77,-9.47,-4.901%,10279924732.0,United States,2016.0,1141059,Consumer Discretionary,Package Goods/Cosmetics
ELME,Elme Communities Common Stock,$15.09,-0.04,-0.264%,1327981597.0,United States,2000.0,370294,Real Estate,Real Estate Investment Trusts
ELP,Companhia Paranaense de Energia (COPEL) American Depositary Shares (each representing one Unit consisting one Common Share and four non-voting Class B Preferred Shares),$7.08,-0.13,-1.803%,2301614721.0,Brazil,2021.0,193770,Utilities,Electric Utilities: Central
ELPC,Companhia Paranaense de Energia (COPEL) American Depositary Shares (each representing four (4) Common Shares),$6.27,-0.09,-1.415%,2038294393.0,Brazil,2023.0,3611,Utilities,Electric Utilities: Central
ELS,Equity Lifestyle Properties Inc. Common Stock,$61.25,0.0,0.00%,11422871486.0,United States,,705852,Real Estate,Real Estate Investment Trusts
ELV,Elevance Health Inc. Common Stock,$505.52,-13.67,-2.633%,117491880126.0,United States,,1412219,Health Care,Medical Specialities
ELVN,Enliven Therapeutics Inc. Common Stock,$21.33,-1.89,-8.14%,1003292768.0,United States,2020.0,138486,Health Care,Biotechnology: Pharmaceutical Preparations
EMBC,Embecta Corp. Common Stock,$12.74,-0.35,-2.674%,734718463.0,United States,,315997,Health Care,Medical/Dental Instruments
EME,EMCOR Group Inc. Common Stock,$393.90,0.22,0.056%,18511819330.0,United States,,443078,Industrials,Engineering & Construction
