Symbol,Name,Last Sale,Net Change,% Change,Market Cap,Country,IPO Year,Volume,Sector,Industry
A,Agilent Technologies Inc. Common Stock,$145.48,-2.73,-1.842%,42633682716.0,United States,1999.0,1593543,Industrials,Electrical Products
AA,Alcoa Corporation Common Stock ,$43.93,0.73,1.69%,7888057094.0,United States,2016.0,5272723,Industrials,Aluminum
AAL,American Airlines Group Inc. Common Stock,$11.62,-1.82,-13.542%,7623769797.0,United States,,158731450,Consumer Discretionary,Air Freight/Delivery Services
AAOI,Applied Optoelectronics Inc. Common Stock,$11.98,-0.4,-3.231%,466117037.0,United States,2013.0,1050863,Technology,Semiconductors
AAON,AAON Inc. Common Stock,$74.87,-2.81,-3.617%,6155008868.0,United States,,447414,Industrials,Industrial Machinery/Components
AAP,Advance Auto Parts Inc.,$62.48,-7.7,-10.972%,3720749104.0,United States,,7796820,Consumer Discretionary,Auto & Home Supply Stores
AAPL,Apple Inc. Common Stock,$190.29,0.3,0.158%,2917922463780.0,United States,1980.0,53006338,Technology,Computer Manufacturing
AAT,American Assets Trust Inc. Common Stock,$20.91,0.0,0.00%,1273287225.0,United States,2011.0,447035,Real Estate,Real Estate Investment Trusts
AB,AllianceBernstein Holding L.P.  Units,$32.86,-0.64,-1.91%,3784276027.0,United States,,151236,Finance,Investment Managers
ABBV,AbbVie Inc. Common Stock,$154.79,-0.55,-0.354%,273338673821.0,United States,2012.0,4253188,Health Care,Biotechnology: Pharmaceutical Preparations
ABCB,Ameris Bancorp Common Stock,$46.96,-0.51,-1.074%,3245276930.0,United States,1994.0,282394,Finance,Major Banks
ABCL,AbCellera Biologics Inc. Common Shares,$4.08,0.0,0.00%,1180571937.0,Canada,2020.0,1595543,Health Care,Pharmaceuticals and Biotechnology
ABEV,Ambev S.A. American Depositary Shares (Each representing 1 Common Share),$2.20,-0.03,-1.345%,34658433225.0,Brazil,2013.0,16162577,Consumer Staples,Beverages (Production/Distribution)
ABG,Asbury Automotive Group Inc Common Stock,$227.39,-5.05,-2.173%,4586964971.0,United States,2002.0,127769,Consumer Discretionary,Retail-Auto Dealers and Gas Stations
ABL,Abacus Life Inc. Class A Common Stock,$11.79,0.09,0.769%,753679476.0,United States,2020.0,50364,Finance,Investment Managers
ABLLL,Abacus Life Inc. 9.875% Fixed Rate Senior Notes due 2028,$25.35,-0.21,-0.822%,1620506761.0,United States,,4200,Finance,Investment Managers
ABM,ABM Industries Incorporated Common Stock,$46.25,-0.3,-0.644%,2927231135.0,United States,,332279,Finance,Diversified Commercial Services
ABNB,Airbnb Inc. Class A Common Stock,$146.61,-0.4,-0.272%,94423263717.0,United States,2020.0,2569954,Finance,Diversified Commercial Services
ABR,Arbor Realty Trust Common Stock,$13.06,-0.2,-1.508%,2462001460.0,United States,2004.0,2690807,Real Estate,Real Estate Investment Trusts
ABSI,Absci Corporation Common Stock,$4.18,-0.09,-2.108%,472689736.0,United States,2021.0,1859980,Health Care,Biotechnology: Commercial Physical & Biological Resarch
ABT,Abbott Laboratories Common Stock,$100.73,-1.22,-1.197%,175233308544.0,United States,,4960852,Health Care,Biotechnology: Pharmaceutical Preparations
ABUS,Arbutus Biopharma Corporation Common Stock,$3.36,0.01,0.299%,634090494.0,Canada,,1030603,Health Care,Biotechnology: Pharmaceutical Preparations
ABVX,Abivax SA American Depositary Shares,$13.12,-0.61,-4.443%,825477324.0,France,2023.0,23543,Health Care,Biotechnology: Pharmaceutical Preparations
AC,Associated Capital Group Inc. Common Stock,$33.85,-0.32,-0.936%,724438169.0,United States,2015.0,2576,Finance,Investment Bankers/Brokers/Service
ACA,Arcosa Inc. Common Stock ,$86.49,-0.69,-0.791%,4201904231.0,United States,2018.0,182052,Industrials,Metal Fabrications
ACAD,ACADIA Pharmaceuticals Inc. Common Stock,$14.62,-0.47,-3.115%,2415529324.0,United States,1985.0,1388580,Health Care,Biotechnology: Pharmaceutical Preparations
ACB,Aurora Cannabis Inc. Common Shares,$6.17,-0.14,-2.219%,336507950.0,Canada,,1461302,Health Care,Pharmaceuticals and Biotechnology
ACCD,Accolade Inc. Common Stock,$7.23,-0.42,-5.49%,566520445.0,United States,2020.0,647854,Consumer Discretionary,Business Services
ACCO,Acco Brands Corporation Common Stock,$5.01,-0.07,-1.378%,479155047.0,United States,,565347,Consumer Discretionary,Publishing
ACDC,ProFrac Holding Corp. Class A Common Stock,$9.34,-0.295,-3.062%,1493802698.0,United States,2022.0,1162373,Energy,Oilfield Services/Equipment
ACEL,Accel Entertainment Inc. ,$9.54,-0.05,-0.521%,798938672.0,United States,2017.0,263027,Consumer Discretionary,Services-Misc. Amusement & Recreation
ACGL,Arch Capital Group Ltd. Common Stock,$101.55,-0.7,-0.685%,38131439767.0,Bermuda,,1367956,Finance,Property-Casualty Insurers
ACGLN,Arch Capital Group Ltd. Depositary Shares each Representing a 1/1000th Interest in a 4.550% Non-Cumulative Preferred Share Series G,$19.32,-0.31,-1.579%,7254548659.0,Bermuda,,13298,Finance,Property-Casualty Insurers
ACGLO,Arch Capital Group Ltd. Depositary Shares Each Representing 1/1000th Interest in a Share of 5.45% Non-Cumulative Preferred Shares Series F,$22.2886,-0.1614,-0.719%,8369240851.0,Bermuda,,16780,Finance,Property-Casualty Insurers
ACHC,Acadia Healthcare Company Inc. Common Stock,$65.07,2.2,3.499%,6036843482.0,United States,,2204595,Health Care,Medical Specialities
ACHR,Archer Aviation Inc. Class A Common Stock,$3.01,-0.19,-5.938%,973909264.0,United States,2020.0,7897279,Industrials,Aerospace
ACI,Albertsons Companies Inc. Class A Common Stock,$20.36,0.0,0.00%,11756020019.0,United States,2020.0,3176639,Consumer Staples,Food Chains
ACIC,American Coastal Insurance Corporation Common Stock,$11.94,-0.04,-0.334%,571072183.0,United States,,173281,Finance,Property-Casualty Insurers
ACIU,AC Immune SA Common Stock,$3.67,-0.2,-5.168%,364056032.0,Switzerland,2016.0,196797,Health Care,Biotechnology: Pharmaceutical Preparations
ACIW,ACI Worldwide Inc. Common Stock,$34.76,0.0,0.00%,3665087170.0,United States,,502197,Technology,EDP Services
ACLS,Axcelis Technologies Inc. Common Stock,$112.89,-2.44,-2.116%,3672593699.0,United States,2000.0,397630,Technology,Industrial Machinery/Components
ACLX,Arcellx Inc. Common Stock,$50.45,-0.85,-1.657%,2699204757.0,United States,2022.0,345833,Health Care,Biotechnology: Biological Products (No Diagnostic Substances)
ACM,AECOM Common Stock,$85.49,-0.98,-1.133%,11637531426.0,United States,2007.0,825707,Consumer Discretionary,Military/Government/Technical
ACMR,ACM Research Inc. Class A Common Stock,$22.62,-0.95,-4.031%,1402634261.0,United States,2017.0,1118718,Technology,Industrial Machinery/Components
ACN,Accenture plc Class A Ordinary Shares (Ireland),$293.77,-3.96,-1.33%,184794167161.0,Ireland,2001.0,4477308,Technology,EDP Services
ACRE,Ares Commercial Real Estate Corporation Common Stock,$6.47,-0.06,-0.919%,352659067.0,United States,2012.0,798474,Real Estate,Real Estate Investment Trusts
ACT,Enact Holdings Inc. Common Stock,$30.28,-0.285,-0.932%,4762811631.0,United States,2021.0,125768,Finance,Specialty Insurers
ACTG,Acacia Research Corporation (Acacia Tech) Common Stock,$5.52,0.0,0.00%,552121170.0,United States,,129118,Miscellaneous,Multi-Sector Companies
ACVA,ACV Auctions Inc. Class A Common Stock,$17.86,-0.81,-4.339%,2948478806.0,United States,2021.0,1415695,Consumer Discretionary,Business Services
ADBE,Adobe Inc. Common Stock,$477.60,-0.83,-0.173%,213964800000.0,United States,1986.0,2212170,Technology,Computer Software: Prepackaged Software
ADC,Agree Realty Corporation Common Stock,$58.88,-0.37,-0.624%,5924855818.0,United States,,872408,Real Estate,Real Estate Investment Trusts
ADEA,Adeia Inc. Common Stock,$11.45,-0.15,-1.293%,1242410280.0,United States,2003.0,374235,Technology,Computer Software: Prepackaged Software
ADI,Analog Devices Inc. Common Stock,$228.15,-5.29,-2.266%,113211875925.0,United States,,3001232,Technology,Semiconductors
ADM,Archer-Daniels-Midland Company Common Stock,$60.03,-0.86,-1.412%,29681100474.0,United States,,3000546,Consumer Staples,Packaged Foods
ADMA,ADMA Biologics Inc Common Stock,$9.40,-0.11,-1.157%,2179006452.0,United States,,2808728,Health Care,Biotechnology: Biological Products (No Diagnostic Substances)
ADNT,Adient plc Ordinary Shares ,$27.03,-0.38,-1.386%,2427932908.0,United States,2016.0,646723,Consumer Discretionary,Auto Parts:O.E.M.
ADP,Automatic Data Processing Inc. Common Stock,$240.09,-3.21,-1.319%,98266755900.0,United States,,1565610,Technology,EDP Services
ADPT,Adaptive Biotechnologies Corporation Common Stock,$3.58,-0.07,-1.918%,527578600.0,United States,2019.0,1950176,Health Care,Biotechnology: Biological Products (No Diagnostic Substances)
ADSE,ADS-TEC ENERGY PLC Ordinary Shares,$11.14,0.09,0.814%,563514260.0,Ireland,,32989,Consumer Discretionary,Industrial Specialties
ADSK,Autodesk Inc. Common Stock,$208.51,-1.94,-0.922%,44603484416.0,United States,,2968841,Technology,Computer Software: Prepackaged Software
ADT,ADT Inc. Common Stock,$7.02,-0.12,-1.681%,6390824975.0,United States,2018.0,3086029,Consumer Discretionary,Diversified Commercial Services
ADTN,ADTRAN Holdings Inc. Common Stock,$5.55,-0.11,-1.943%,439096769.0,United States,1994.0,792683,Utilities,Telecommunications Equipment
ADUS,Addus HomeCare Corporation Common Stock,$110.94,-0.87,-0.778%,1816125076.0,United States,2009.0,58127,Health Care,Medical/Nursing Services
ADV,Advantage Solutions Inc. Class A Common Stock,$3.52,-0.02,-0.565%,1134071907.0,United States,2019.0,867172,Consumer Discretionary,Business Services
AEE,Ameren Corporation Common Stock,$70.10,-1.13,-1.586%,18693593217.0,United States,,976493,Utilities,Power Generation
AEF,abrdn Emerging Markets Equity Income Fund Inc. Common Stock,$5.23,-0.095,-1.784%,561505875.0,United States,,86200,Finance,Finance/Investors Services
AEG,Aegon Ltd. New York Registry Shares,$6.48,0.02,0.31%,14285070265.0,Netherlands,,2218056,Finance,Life Insurance
AEHR,Aehr Test Systems Common Stock,$11.05,-0.51,-4.412%,319507755.0,United States,1997.0,494161,Industrials,Electrical Products
AEIS,Advanced Energy Industries Inc. Common Stock,$104.31,-3.2,-2.976%,3905643865.0,United States,1995.0,98283,Technology,Industrial Machinery/Components
AEM,Agnico Eagle Mines Limited Common Stock,$67.39,-1.54,-2.234%,33623609932.0,Canada,,1703208,Basic Materials,Precious Metals
AEO,American Eagle Outfitters Inc. Common Stock,$24.05,0.14,0.586%,4741614402.0,United States,,6380294,Consumer Discretionary,Clothing/Shoe/Accessory Stores
AEP,American Electric Power Company Inc. Common Stock,$87.47,-1.15,-1.298%,46107340260.0,United States,,2437908,Utilities,Electric Utilities: Central
AER,AerCap Holdings N.V. Ordinary Shares,$90.35,-1.45,-1.58%,18295257729.0,Netherlands,2006.0,1086730,Consumer Discretionary,Diversified Commercial Services
AES,The AES Corporation Common Stock,$21.07,-0.06,-0.284%,14973746252.0,United States,,5329155,Utilities,Electric Utilities: Central
AESI,Atlas Energy Solutions Inc. Common Stock,$23.30,-0.7,-2.917%,2559516557.0,United States,2023.0,703947,Industrials,Mining & Quarrying of Nonmetallic Minerals (No Fuels)
AFG,American Financial Group Inc. Common Stock,$125.35,-1.14,-0.901%,10512724940.0,United States,,200621,Finance,Property-Casualty Insurers
AFGB,American Financial Group Inc. 5.875% Subordinated Debentures due 2059,$23.0499,-0.1501,-0.647%,1933125318.0,United States,2019.0,3058,Finance,Property-Casualty Insurers
AFGC,American Financial Group Inc. 5.125% Subordinated Debentures due 2059,$20.76,-0.34,-1.611%,1741078339.0,United States,2019.0,8724,Finance,Property-Casualty Insurers
AFGD,American Financial Group Inc. 5.625% Subordinated Debentures due 2060,$22.36,-0.04,-0.179%,1875265494.0,United States,2020.0,7701,,
AFGE,American Financial Group Inc. 4.500% Subordinated Debentures due 2060,$18.35,-0.23,-1.238%,1538958936.0,United States,2020.0,16026,,
AFL,AFLAC Incorporated Common Stock,$87.18,-0.08,-0.092%,49537632929.0,United States,,1509484,Finance,Accident &Health Insurance
AFRM,Affirm Holdings Inc. Class A Common Stock,$28.72,-0.92,-3.104%,8878059632.0,United States,2021.0,4321905,Finance,Finance: Consumer Services
AFYA,Afya Limited Class A Common Shares,$17.15,-0.56,-3.162%,1542631404.0,Brazil,2019.0,97945,Real Estate,Other Consumer Services
AG,First Majestic Silver Corp. Ordinary Shares (Canada),$7.26,-0.35,-4.599%,2085257297.0,Canada,,5080519,,
AGCO,AGCO Corporation Common Stock,$104.65,-1.51,-1.422%,7808930780.0,United States,,1314042,Industrials,Industrial Machinery/Components
AGEN,Agenus Inc. Common Stock,$15.03,-0.22,-1.443%,315618893.0,United States,2000.0,850562,Health Care,Biotechnology: Biological Products (No Diagnostic Substances)
AGI,Alamos Gold Inc. Class A Common Shares,$16.75,-0.35,-2.047%,6645911553.0,Canada,2015.0,1384575,,
AGIO,Agios Pharmaceuticals Inc. Common Stock,$38.00,-0.81,-2.087%,2157372708.0,United States,2013.0,1131243,Health Care,Biotechnology: Pharmaceutical Preparations
AGL,agilon health inc. Common Stock,$5.76,-0.35,-5.728%,2368866868.0,United States,2021.0,2443410,Health Care,Misc Health and Biotechnology Services
AGM,Federal Agricultural Mortgage Corporation Common Stock,$171.93,-1.81,-1.042%,1870742993.0,United States,,39191,Finance,Finance Companies
AGNC,AGNC Investment Corp. Common Stock,$9.47,-0.12,-1.251%,6884019685.0,United States,2008.0,14959201,Real Estate,Real Estate Investment Trusts
AGNCL,AGNC Investment Corp. Depositary Shares Each Representing a 1/1000th Interest in a Share of 7.75% Series G Fixed-Rate Reset Cumulative Redeemable Preferred Stock,$24.14,-0.11,-0.454%,17548071298.0,United States,,12766,Real Estate,Real Estate Investment Trusts
AGNCM,AGNC Investment Corp. Depositary Shares rep 6.875% Series D Fixed-to-Floating Cumulative Redeemable Preferred Stock,$25.07,-0.05,-0.199%,11979248240.0,United States,,29261,Real Estate,Real Estate Investment Trusts
AGNCN,AGNC Investment Corp. Depositary Shares Each Representing a 1/1000th Interest in a Share of 7.00% Series C Fixed-To-Floating Rate Cumulative Redeemable Preferred Stock,$25.58,-0.09,-0.351%,12222942560.0,United States,,9713,Real Estate,Real Estate Investment Trusts
AGO,Assured Guaranty Ltd. Common Stock,$76.14,0.95,1.263%,4145282558.0,Bermuda,2004.0,431833,Finance,Property-Casualty Insurers
AGR,Avangrid Inc. Common Stock,$35.80,-0.05,-0.139%,13851244108.0,United States,2015.0,1085248,Utilities,Electric Utilities: Central
AGRO,Adecoagro S.A. Common Shares,$9.70,-0.22,-2.218%,1010107686.0,Luxembourg,2011.0,506833,Consumer Staples,Farming/Seeds/Milling
AGS,PlayAGS Inc. Common Stock,$11.50,0.03,0.262%,453727291.0,United States,2018.0,498931,Consumer Discretionary,Miscellaneous manufacturing industries
AGX,Argan Inc. Common Stock,$69.16,-0.11,-0.159%,915686768.0,United States,,63748,Consumer Discretionary,Engineering & Construction
AGYS,Agilysys Inc. Common Stock (DE),$96.67,-3.18,-3.185%,2653998771.0,United States,,387551,Technology,EDP Services
AHCO,AdaptHealth Corp. Common Stock,$9.99,-0.12,-1.187%,1330687221.0,United States,2018.0,585884,Health Care,Medical/Nursing Services
AHH,Armada Hoffler Properties Inc. Common Stock,$10.93,-0.31,-2.758%,733112819.0,United States,2013.0,474868,Finance,Real Estate
AHR,American Healthcare REIT Inc. Common Stock,$14.07,0.0,0.00%,1852273543.0,,2024.0,801331,Real Estate,Real Estate Investment Trusts
AI,C3.ai Inc. Class A Common Stock,$23.92,-0.18,-0.747%,2919407081.0,United States,2020.0,10723775,Technology,Computer Software: Prepackaged Software
AIG,American International Group Inc. New Common Stock,$77.57,0.21,0.271%,51480727458.0,United States,,3747909,Finance,Life Insurance
AILE,iLearningEngines Inc. Common Stock,$6.30,0.03,0.478%,846175012.0,United States,2021.0,113980,Technology,Computer Software: Prepackaged Software
AIN,Albany International Corporation Common Stock,$85.34,-2.05,-2.346%,2662608000.0,United States,,98872,Consumer Discretionary,Textiles
AIO,Virtus Artificial Intelligence & Technology Opportunities Fund Common Shares of Beneficial Interest,$19.91,-0.05,-0.251%,683728753.0,,2019.0,104346,Finance,Finance/Investors Services
AIP,Arteris Inc. Common Stock,$7.97,-0.32,-3.86%,306678602.0,United States,2021.0,193314,Technology,Semiconductors
AIR,AAR Corp. Common Stock,$69.32,-1.48,-2.09%,2455803522.0,United States,,134623,Industrials,Aerospace
AIRC,Apartment Income REIT Corp. Common Stock,$38.71,0.01,0.026%,5616984395.0,United States,2020.0,2535667,Real Estate,Real Estate Investment Trusts
AIRJ,Montana Technologies Corporation Class A Common Stock,$16.98,-2.91,-14.63%,913921536.0,United States,2022.0,206480,Finance,Blank Checks
AIT,Applied Industrial Technologies Inc. Common Stock,$190.47,-5.39,-2.752%,7352640460.0,United States,,164883,Consumer Discretionary,Industrial Specialties
AIV,Apartment Investment and Management Company Common Stock,$7.77,-0.19,-2.387%,1125306761.0,United States,1994.0,1474882,Real Estate,Real Estate Investment Trusts
AIZ,Assurant Inc. Common Stock,$169.05,0.48,0.285%,8788200166.0,United States,2004.0,624173,Finance,Property-Casualty Insurers
AIZN,Assurant Inc. 5.25% Subordinated Notes due 2061,$20.86,-0.1522,-0.724%,1084423871.0,United States,2020.0,10442,Finance,Property-Casualty Insurers
AJG,Arthur J. Gallagher & Co. Common Stock,$245.32,-3.01,-1.212%,53602420000.0,United States,,481195,Finance,Specialty Insurers
AKAM,Akamai Technologies Inc. Common Stock,$90.84,-1.75,-1.89%,13836435220.0,United States,1999.0,1332211,Consumer Discretionary,Business Services
AKR,Acadia Realty Trust Common Stock,$16.43,0.07,0.428%,1695271519.0,United States,,1155528,Real Estate,Real Estate Investment Trusts
AKRO,Akero Therapeutics Inc. Common Stock,$18.66,-0.84,-4.308%,1290357791.0,United States,2019.0,568944,Health Care,Biotechnology: Pharmaceutical Preparations
AL,Air Lease Corporation Class A Common Stock,$46.55,-1.31,-2.737%,5184110622.0,United States,2011.0,1136574,Consumer Discretionary,Diversified Commercial Services
ALAB,Astera Labs Inc. Common Stock,$67.45,-1.44,-2.09%,10502052752.0,United States,2024.0,1350135,Technology,Semiconductors
ALB,Albemarle Corporation Common Stock,$123.44,-4.32,-3.381%,14507591267.0,United States,,1764522,Industrials,Major Chemicals
ALC,Alcon Inc. Ordinary Shares,$87.37,-0.86,-0.975%,43658789000.0,Switzerland,2019.0,1046470,Health Care,Ophthalmic Goods
ALE,Allete Inc.,$62.25,-0.17,-0.272%,3589712795.0,United States,,505329,Utilities,Power Generation
ALEC,Alector Inc. Common Stock,$5.00,-0.13,-2.534%,481922810.0,United States,2019.0,696789,Health Care,Biotechnology: Biological Products (No Diagnostic Substances)
ALEX,Alexander & Baldwin Inc. Common Stock REIT Holding Company,$16.29,-0.04,-0.245%,1182526075.0,United States,,261890,Real Estate,Real Estate Investment Trusts
ALG,Alamo Group Inc. Common Stock,$187.56,-3.76,-1.965%,2260602349.0,United States,,37982,Industrials,Industrial Machinery/Components
ALGM,Allegro MicroSystems Inc. Common Stock,$29.86,-0.93,-3.02%,5785319162.0,United States,2020.0,864458,Technology,Semiconductors
ALGN,Align Technology Inc. Common Stock,$252.76,-1.01,-0.398%,19028199206.0,United States,2001.0,763179,Health Care,Industrial Specialties
ALGT,Allegiant Travel Company Common Stock,$48.37,-0.6,-1.225%,881895577.0,United States,2006.0,419161,Consumer Discretionary,Air Freight/Delivery Services
ALHC,Alignment Healthcare Inc. Common Stock,$6.98,-0.43,-5.803%,1334563890.0,United States,2021.0,517989,Health Care,Medical Specialities
ALIT,Alight Inc. Class A Common Stock,$7.63,-0.27,-3.418%,4284170852.0,United States,2021.0,5050860,Technology,EDP Services
ALK,Alaska Air Group Inc. Common Stock,$40.65,-1.09,-2.611%,5158153215.0,United States,,2842058,Consumer Discretionary,Air Freight/Delivery Services
ALKS,Alkermes plc Ordinary Shares,$23.29,-0.46,-1.937%,3941164333.0,Ireland,1991.0,2075783,Health Care,Biotechnology: Pharmaceutical Preparations
ALKT,Alkami Technology Inc. Common Stock,$28.65,0.55,1.957%,2793818588.0,United States,2021.0,483395,Technology,Computer Software: Prepackaged Software
ALL,Allstate Corporation (The) Common Stock,$163.50,-1.17,-0.711%,43150156782.0,United States,,827852,Finance,Property-Casualty Insurers
ALLE,Allegion plc Ordinary Shares,$119.39,-1.03,-0.855%,10439544695.0,United States,2013.0,398233,Consumer Discretionary,Diversified Commercial Services
ALLO,Allogene Therapeutics Inc. Common Stock,$2.33,-0.1,-4.115%,398088373.0,United States,2018.0,4082172,Health Care,Biotechnology: Biological Products (No Diagnostic Substances)
ALLY,Ally Financial Inc. Common Stock,$37.89,-0.23,-0.603%,11517848502.0,United States,2014.0,1215010,Finance,Major Banks
ALNT,Allient Inc. Common Stock,$26.03,-0.72,-2.692%,436670352.0,United States,,117432,Industrials,Electrical Products
ALNY,Alnylam Pharmaceuticals Inc. Common Stock,$146.93,-3.13,-2.086%,18585436942.0,United States,2004.0,875955,Health Care,Biotechnology: Pharmaceutical Preparations
ALRM,Alarm.com Holdings Inc. Common Stock,$66.36,-0.78,-1.162%,3330523194.0,United States,2015.0,3652798,Technology,Computer Software: Prepackaged Software
ALRS,Alerus Financial Corporation Common Stock,$18.73,-0.51,-2.651%,370419202.0,United States,2019.0,60475,Finance,Major Banks
ALSN,Allison Transmission Holdings Inc. Common Stock,$74.48,-0.64,-0.852%,6515373953.0,United States,2012.0,375883,Consumer Discretionary,Auto Parts:O.E.M.
ALT,Altimmune Inc. Common Stock,$6.85,-0.12,-1.722%,485680008.0,United States,,2109153,Health Care,Biotechnology: Pharmaceutical Preparations
ALTI,AlTi Global Inc. Class A Common Stock,$5.07,0.03,0.595%,608438730.0,United States,2021.0,189405,Finance,Investment Managers
ALTM,Arcadium Lithium plc Ordinary Shares,$4.36,-0.21,-4.595%,4687835572.0,United States,2024.0,8798145,Industrials,Major Chemicals
ALTR,Altair Engineering Inc. Class A Common Stock,$89.68,-1.19,-1.31%,7446386885.0,United States,2017.0,254798,Technology,Computer Software: Prepackaged Software
ALV,Autoliv Inc. Common Stock,$126.00,-3.11,-2.409%,10253197584.0,Sweden,,652157,Consumer Discretionary,Auto Parts:O.E.M.
ALVO,Alvotech Ordinary Shares,$13.60,-0.39,-2.788%,3628777078.0,Luxembourg,,80409,Health Care,Biotechnology: Biological Products (No Diagnostic Substances)
ALVOW,Alvotech Warrant,$3.15,0.15,5.00%,840488809.0,Luxembourg,,4566,Health Care,Biotechnology: Biological Products (No Diagnostic Substances)
ALX,Alexander's Inc. Common Stock,$209.24,0.11,0.053%,1068649360.0,United States,,9430,Real Estate,Real Estate Investment Trusts
ALXO,ALX Oncology Holdings Inc. Common Stock,$11.19,-1.37,-10.908%,583000197.0,United States,2020.0,1129196,Health Care,Biotechnology: Pharmaceutical Preparations
AM,Antero Midstream Corporation Common Stock,$14.41,-0.06,-0.415%,6934682810.0,United States,2017.0,1935709,Utilities,Natural Gas Distribution
AMAL,Amalgamated Financial Corp. Common Stock (DE),$25.02,-0.15,-0.596%,763711456.0,United States,2018.0,153020,Finance,Major Banks
AMAT,Applied Materials Inc. Common Stock,$219.05,-2.27,-1.026%,181367886073.0,United States,1972.0,4716946,Technology,Semiconductors
AMBA,Ambarella Inc. Ordinary Shares,$49.15,-1.2,-2.383%,2013291688.0,United States,2012.0,477264,Technology,Semiconductors
AMBC,Ambac Financial Group Inc. Common Stock,$17.21,-0.02,-0.116%,778321768.0,United States,,218409,Finance,Property-Casualty Insurers
AMBP,Ardagh Metal Packaging S.A. Ordinary Shares,$3.83,-0.07,-1.795%,2288769700.0,,,1609727,Industrials,Containers/Packaging
AMC,AMC Entertainment Holdings Inc. Class A Common Stock,$4.50,-0.38,-7.787%,1330144862.0,United States,2013.0,40672808,Consumer Discretionary,Movies/Entertainment
AMCR,Amcor plc Ordinary Shares,$9.73,-0.1,-1.017%,14063189453.0,,2019.0,6653533,Consumer Discretionary,Miscellaneous manufacturing industries
AMCX,AMC Networks Inc. Class A Common Stock,$16.25,-0.81,-4.748%,715703138.0,United States,,446657,Telecommunications,Cable & Other Pay Television Services
AMD,Advanced Micro Devices Inc. Common Stock,$165.14,-6.47,-3.77%,266918072657.0,United States,,56449112,Technology,Semiconductors
AME,AMETEK Inc.,$166.71,-1.6,-0.951%,38588293849.0,United States,,1281782,Industrials,Industrial Machinery/Components
AMED,Amedisys Inc Common Stock,$95.60,0.0,0.00%,3123909632.0,United States,,510038,Health Care,Medical/Nursing Services
AMG,Affiliated Managers Group Inc. Common Stock,$158.45,-1.49,-0.932%,5048923053.0,United States,,198890,Finance,Investment Managers
AMGN,Amgen Inc. Common Stock,$296.37,-3.82,-1.273%,158983149668.0,United States,1983.0,2473367,Health Care,Biotechnology: Pharmaceutical Preparations
AMH,American Homes 4 Rent Common Shares of Beneficial Interest,$35.46,-0.25,-0.70%,12989779751.0,United States,2013.0,1962979,Real Estate,Real Estate Investment Trusts
AMK,AssetMark Financial Holdings Inc. Common Stock,$34.10,-0.01,-0.029%,2537052481.0,United States,2019.0,276400,Finance,Finance/Investors Services
AMKR,Amkor Technology Inc. Common Stock,$32.53,-0.93,-2.779%,8007918265.0,United States,1998.0,588929,Technology,Semiconductors
AMN,AMN Healthcare Services Inc,$54.02,-1.25,-2.262%,2052606961.0,United States,,751727,Health Care,Assisted Living Services
AMP,Ameriprise Financial Inc. Common Stock,$427.98,-6.99,-1.607%,42509080546.0,United States,,385013,Finance,Investment Managers
AMPH,Amphastar Pharmaceuticals Inc. Common Stock,$41.64,-0.335,-0.798%,2036277823.0,United States,2014.0,201587,Health Care,Biotechnology: Pharmaceutical Preparations
AMPL,Amplitude Inc. Class A Common Stock,$9.14,-0.37,-3.891%,1113626064.0,United States,,990999,Technology,Computer Software: Prepackaged Software
AMPS,Altus Power Inc. Class A Common Stock,$3.94,-0.21,-5.06%,633047408.0,United States,2021.0,811362,Utilities,Electric Utilities: Central
AMR,Alpha Metallurgical Resources Inc. Common Stock,$308.21,-1.52,-0.491%,4008953735.0,United States,2018.0,128265,Energy,Coal Mining
AMRC,Ameresco Inc. Class A Common Stock,$34.15,-0.54,-1.557%,1787363258.0,United States,2010.0,515911,Consumer Discretionary,Engineering & Construction
AMRK,A-Mark Precious Metals Inc. Common Stock,$38.45,-1.01,-2.56%,880305598.0,United States,,207290,Industrials,Other Specialty Stores
